{
  "version": "2026-05-29.pillar-01",
  "purpose": "Whole-app CEO truth for feature claims, proof status, blockers, and audit freshness. This registry is deliberately honest: registry presence is not implementation proof.",
  "status_vocabulary": [
    "not_started",
    "stub",
    "partial",
    "implemented",
    "broken",
    "unknown"
  ],
  "proof_vocabularies": {
    "proof_status": [
      "none",
      "planned",
      "smoke",
      "partial",
      "strong",
      "external_verified",
      "stale"
    ],
    "dogfood_status": [
      "none",
      "planned",
      "ad_hoc",
      "windowed",
      "continuous",
      "stale"
    ],
    "external_status": [
      "none",
      "planned",
      "replayable",
      "external_verified",
      "stale"
    ]
  },
  "features": [
    {
      "id": "feature.setup_install_onboarding",
      "name": "Setup, install, and onboarding",
      "category": "setup/install/onboarding",
      "user_contract": "A new user can install memd, run first-use onboarding, and reach a working local proof without hand-editing hidden state.",
      "implementation_surfaces": [
        "install scripts",
        "memd CLI setup paths",
        "scripts/verify/setup-experience-smoke.sh"
      ],
      "docs": [
        "START-HERE.md",
        "README.md",
        "docs/setup/README.md",
        "docs/setup/install.md",
        "docs/setup/update.md",
        "docs/setup/uninstall.md",
        "docs/setup/first-run.md",
        "docs/verification/setup-experience-scorecard.md",
        "docs/verification/feature-setup-install-onboarding-25.md"
      ],
      "proof_commands": [
        "bash scripts/verify/feature-setup-install-onboarding-proof.sh",
        "bash scripts/verify/setup-experience-smoke.sh"
      ],
      "proof_artifacts": [
        "docs/verification/feature-setup-install-onboarding-25.md",
        "scripts/verify/feature-setup-install-onboarding-proof.sh",
        "scripts/verify/setup-experience-smoke.sh"
      ],
      "current_status": "partial",
      "proof_status": "strong",
      "dogfood_status": "ad_hoc",
      "external_status": "planned",
      "blocks_25_25": true,
      "scorecard_axes": [
        "first_run",
        "install_reliability",
        "time_to_value",
        "recovery"
      ],
      "allowed_claims": [
        "Setup/install/onboarding slice has local 25-star implementation proof; external validation remains pending."
      ],
      "forbidden_claims": [
        "Do not claim public 25/25, universal one-command install, production onboarding, or external validation until external replay passes."
      ],
      "freshness_policy": "Re-run feature setup/install/onboarding proof after installer, CLI bootstrap, setup docs, README/START-HERE, update/uninstall scripts, or release changes."
    },
    {
      "id": "feature.docs_product_education",
      "name": "Docs and product education",
      "category": "docs/product education",
      "user_contract": "Docs tell users what memd does, what is proven, what is aspirational, and where to start without conflicting claims.",
      "implementation_surfaces": [
        "README.md",
        "START-HERE.md",
        "ROADMAP.md",
        "docs/**/*.md",
        "scripts/doc-lint.sh"
      ],
      "docs": [
        "README.md",
        "START-HERE.md",
        "docs/setup/README.md",
        "docs/verification/FEATURES.md",
        "docs/verification/feature-coverage-report.md",
        "docs/product/INDEX.md",
        "docs/verification/feature-docs-product-education-25.md"
      ],
      "proof_commands": [
        "bash scripts/doc-lint.sh",
        "bash scripts/verify/feature-registry-audit.sh",
        "bash scripts/verify/feature-docs-product-education-proof.sh"
      ],
      "proof_artifacts": [
        "docs/verification/feature-coverage-report.md",
        "docs/verification/feature-docs-product-education-25.md",
        "scripts/verify/feature-docs-product-education-proof.sh"
      ],
      "current_status": "partial",
      "proof_status": "strong",
      "dogfood_status": "ad_hoc",
      "external_status": "none",
      "blocks_25_25": true,
      "scorecard_axes": [
        "truthfulness",
        "navigability",
        "freshness"
      ],
      "allowed_claims": [
        "Registry defines current whole-app truth fields.",
        "Docs/product education has strong local proof for navigation, start-here/README/setup/CLI alignment, setup examples, claim-to-proof mapping, and honest pending language when the proof script passes."
      ],
      "forbidden_claims": [
        "Do not claim docs prove product behavior without linked executable proof.",
        "Do not claim external validation, dogfood readiness, production readiness, or whole-product 25/25 from local docs proof alone."
      ],
      "freshness_policy": "Update registry, coverage report, FEATURES row, and product education proof whenever beginner navigation, README/START-HERE/setup docs, CLI setup/help surfaces, feature claims, proof artifacts, or status language changes."
    },
    {
      "id": "feature.doctor_status_recovery_update_uninstall",
      "name": "Doctor, status, recovery, update, and uninstall",
      "category": "doctor/status/recovery/update/uninstall",
      "user_contract": "A user can inspect health, understand failures, recover safely, update, and uninstall without losing data unexpectedly.",
      "implementation_surfaces": [
        "memd doctor/status CLI",
        "scripts/update-memd.sh",
        "scripts/uninstall-memd.sh",
        "state backup/recovery paths"
      ],
      "docs": [
        "docs/setup/update.md",
        "docs/setup/uninstall.md",
        "docs/setup/troubleshooting.md",
        "docs/verification/feature-doctor-status-recovery-update-uninstall-25.md"
      ],
      "proof_commands": [
        "bash scripts/verify/feature-doctor-status-recovery-update-uninstall-proof.sh"
      ],
      "proof_artifacts": [
        "docs/verification/feature-doctor-status-recovery-update-uninstall-25.md",
        "local temp proof summary emitted by scripts/verify/feature-doctor-status-recovery-update-uninstall-proof.sh"
      ],
      "current_status": "partial",
      "proof_status": "strong",
      "dogfood_status": "ad_hoc",
      "external_status": "planned",
      "blocks_25_25": true,
      "scorecard_axes": [
        "operability",
        "data_safety",
        "recovery",
        "lifecycle_dry_runs",
        "failure_modes"
      ],
      "allowed_claims": [
        "Doctor/status/update/uninstall recovery slice has local executable proof for current repository surfaces.",
        "Update and uninstall dry-runs state that .memd memory is preserved by default.",
        "Doctor repair can recover generated bundle env files without deleting seeded memory/state sentinel files in the local proof."
      ],
      "forbidden_claims": [
        "Do not claim external verification until an independent replay is recorded.",
        "Do not claim destructive reset safety or complete package-manager uninstall coverage until those contracts exist and are proven.",
        "Do not claim all real-world corruptions are recoverable from this local generated-file recovery proof."
      ],
      "freshness_policy": "Re-run the lifecycle proof after any doctor/status, setup bundle layout, .memd storage, update, uninstall, reset, or recovery behavior change; add external replay before unblocking 25/25."
    },
    {
      "id": "feature.memory_core",
      "name": "Memory capture, lookup, recall, corrections, provenance, and trust",
      "category": "memory capture/lookup/recall/corrections/provenance/trust",
      "user_contract": "Users can capture memories, retrieve them accurately, correct them, and inspect provenance/trust boundaries.",
      "implementation_surfaces": [
        "crates/memd-client",
        "crates/memd-server",
        "memory store",
        "correction/provenance surfaces"
      ],
      "docs": [
        "docs/verification/FEATURES.md",
        "docs/verification/COVERAGE-MATRIX.md",
        "docs/verification/feature-memory-core-25.md"
      ],
      "proof_commands": [
        "bash scripts/verify/feature-memory-core-proof.sh",
        "bash scripts/memd-cargo-guard.sh check -p memd-client -p memd-core -p memd-schema",
        "bash scripts/memd-cargo-guard.sh test -p memd-client correction_e2e_tests",
        "bash scripts/memd-cargo-guard.sh test -p memd-client recall_depth_tests",
        "bash scripts/memd-cargo-guard.sh test -p memd-client runtime_memory_tests"
      ],
      "proof_artifacts": [
        "docs/verification/feature-memory-core-25.md",
        "crates/memd-client/src/main_tests/correction_e2e_tests/mod.rs",
        "crates/memd-client/src/main_tests/recall_depth_tests/mod.rs",
        "crates/memd-client/src/main_tests/runtime_memory_tests/mod.rs",
        "crates/memd-server/src/tests/memory_behaviors.rs",
        "docs/verification/release-0-1-0/*axis-correction_retention*",
        "docs/verification/release-0-1-0/*axis-trust_provenance*"
      ],
      "current_status": "partial",
      "proof_status": "strong",
      "dogfood_status": "ad_hoc",
      "external_status": "none",
      "blocks_25_25": true,
      "scorecard_axes": [
        "recall_quality",
        "provenance",
        "correction_safety",
        "trust"
      ],
      "allowed_claims": [
        "Memory-core substrate surfaces have current local proof coverage across capture, lookup, resume, corrections, provenance, and trust boundaries."
      ],
      "forbidden_claims": [
        "Do not claim reliable memory OS, perfect recall, production-grade trust, or external verification from this local proof artifact alone."
      ],
      "freshness_policy": "Re-run feature-memory-core-proof plus guarded memory cargo check/tests after ingest, store, lookup, resume, correction, provenance, schema, or trust-boundary changes."
    },
    {